SKU,NAME,DESCRIPTION,QTY,PRICE,COLOR,SIZE,CATEGORY,GENDER,SEASON,,,,,,,,,,,,
221,Ralph Lauren Vest Herre Strik HZ,du også tøj med mærket Ralph Lauren RLX (Ralph Lauren X-treme). RLX tøj er specielle tekniske produkter, designet til at modstå vind, vand, varme og kulde. Ralph Lauren produkter er generelt trendsættende indenfor modeverdenen. ,2,50,Sort,XS,Jakker,Dame,PS17,,,,,,,,,
222,Ralph Lauren Polo Herre Solid Stretch Mesh,Hos Pro Golf forhandler vi Ralph Lauren Golf. Mærket er kendt for tidløst design og høj kvalitet. Hos Pro Golf finder du også tøj med mærket Ralph Lauren RLX (Ralph Lauren X-treme). RLX tøj er specielle tekniske produkter, designet til at modstå vind, vand, varme og kulde. Ralph Lauren produkter er generelt trendsættende indenfo,1,150,Gul,XS,Jakker,Dame,PS17,,,,,,,,,
223,Ralph Lauren Polo Herre Stripe Pique,Hos Pro Golf forhandler vi Ralph Lauren Golf. Mærket er kendt for tidløst design og høj kvalitet. Hos Pro Golf finder du også tøj med mærket Ralph Lauren RLX (Ralph Lauren X-treme). RLX tøj er specielle tekniske produkter, designet til at modstå vind, vand, varme og kulde. Ralph Lauren produkter er generelt trendsættende indenfor modeverdenen.,11,200,Gul,L,Bukser,Mand,PS17,,,,,,,,,
224,Ralph Lauren Polo Herre Custom-Fit,Ralph Lauren Custom-Fit Herre Polo - Den klassiske custom-fit polo fra Ralph Lauren,1,70,Gul,M,Bluser,Dame,PS17,,,,,,,,,,,,
225,Ralph Lauren Vindjakke Herre Classic,Hos Pro Golf forhandler vi Ralph Lauren Golf. Mærket er kendt for tidløst design og høj kvalitet. Hos Pro Golf finder du også tøj med mærket Ralph Lauren RLX (Ralph Lauren X-treme). RLX tøj er specielle tekniske produkter, designet til at modstå,3,70,Gul,M,Kjoler,Dame,PS17,,,,,,,,,,,
226,Ralph Lauren Strømper Herre Sport 3-pack,Ralph Lauren ankel herrestrømper - Smarte, korte golfstrømper i utrolig blød kvalitet.,6,70,Gul,S,Shorts,Mand,PS17,,,,,,,,,,,
227,Ralph Lauren Strømper Herre Fil d'Ecosse,Klassiske herrestrømper, som med fordel kan anvendes på og uden for golfbanen.,9,69,Rød,L,Shorts,Dame,PS17,,,,,,,,,,,
228,Ralph Lauren Strik Herre Classic Halfzip,Hos Pro Golf forhandler vi Ralph Lauren Golf. Mærket er kendt for tidløst design og høj kvalitet. Hos Pro Golf finder du også tøj med mærket Ralph Lauren RLX (Ralph Lauren X-treme). RLX tøj er specielle tekniske produkter, designet til at modstå vind, vand, varme og kulde. Ralph Lauren produkter er generelt trends,4,30,Rød,M,Kjoler,Dame,PS17,,,,,,,,,
229,Peak Performance Sweater Herre Heli FZ,Med Peak Performance Heli sweater har du en varm og yderst åndbar sweater, der hjælper dig med, at holde vinden væk fra kroppen. Sweateren er designet i lækre materialer, der giver optimal bevægelsesfrihed.,5,30,Rød,S,Jakker,Mand,PS17,,,,,,,,,
230,Tabiso Chardonnay,Du får en flot sydafrikansk hvidvin med et strejf af egetræ. Vine har en duft af tropiske frugter, og med en frisk og fyldig frugtsmag. Det er en harmonisk vin, med en bl,5,100,Blå,XL,Bluser,Dam,PS17,,,,,,,,,,
231,Tabiso Shiraz,Vinen har en flot dybrød farve. Den har en let krydret og frugtig bouquet, med et strejf af egetræ. Smagen er utrolig delikat, fyldig og frugtrig med en blød og behagelig eftersmag.,8,50,Gul,S,T-shirts,Mand,PS17,,,,,,,,,,
232,Vito Negroamaro Zinfandel,Her får du en rødvin fra det det sydlige Italien. Puglia-regionen udgør hælen på støvlen af Italien.Denne syditalienske rødvin har en dejlig blødhed og sødme, der gør, at vinen vil være et hit hos mange. Puglia-regionens vine har i det hele taget igennem de sidste år flyttede sig højere op på den internationale rangstige.Dru,2,75,Sort,L,T-shirts,Mand,PS17,,,,,,,,,,
233,Aventura Merlot,Du får her en fyldig rødvin med bløde tanniner fra Central Valley. Det er Chiles mest produktive og internationale kendte vinområde. Druen er i dette tilfælde ren Merlot.,7,75,Sort,XL,Badetøj,Dame,PS17,,,,,,,,,,,,
234,Lambrusco Rosato Amabil,Denne lettere mousserende rosévin har en rosa farve. Den er lavet 100 % Lambrusco druer. Den har et indhold af alkohol på 8%. Den har nogle dejlige perlende bobler og en frugtrig duft af jordbær og hindbær.,11,75,Sort,M,Bluser,Dame,PS17,,,,,,,,,,,,
235,La Source Vignelaure Rosè,Du får en elegant flaske rosè. Vinen har flotte milde toner af sommerens bær, citrus og er en dejlig behagelig oplevelse i smagen. Den er lavet på 60% Grenache, 20% Cinsault% og 20% Syrah. Den indeholder 12,5% alkohol.,15,100,Sort,L,Bukser,Mand,PS17,,,,,,,,,
236,Beach Club Rose,Vinen har en skøn duft af sommerfrugter som friske jordbær og hindbær. Den har en frisk og sprød frugtsmag efterfulgt af en blid og behagelig eftersmag. Den er lavet på 60% Cinsault og 40% Grenache og har en alkoholprocent på 12.,1,50,Sort,M,Bukser,Dame,PS17,,,,,,,,,,,,
237,Tarani Gamay Vinovalie Rose,Denne vin er produceret af 100% Gamay druer, der er dyrket i Comté Tolosan området omkring Toulouse i den sydvestlige del af Frankrig. Vinen har udelukkende været lagret i cementtanke.,3,150,Blå,S,Jakker,Mand,PS17,,,,,,,,,,,
238,Tabiso Chardonnay,Du får en flot sydafrikansk hvidvin med et strejf af egetræ. Vine har en duft af tropiske frugter, og med en frisk og fyldig frugtsmag. Det er en harmonisk vin, med en blid og behagelig eftersmag. Den er lavet på 100% Chardonnay drue, som er lagret på franske egetræsfade. Den har et indhold af alkohol på 13,5%.,7,200,Blå,M,Bluser,Mand,MS17,,,,,,,,
239,Santa Rita 120 Chardonnay,Du får her en ekstraordinær velafbalanceret hverdags hvidvin. Farven er klar gul, og med en bouquet af passionfrugt, mango, ananas og vanilje. Den er lavet på 100% Chardonnay og med en alkoholprocent på 13,5,9,70,Rød,M,T-shirts,Mand,MS17,,,,,,,,
240,P.Maufoux Chardonnay Horizon,Denne hvidvin er lavet af 100% Chardonnay druer, der er nøje udvalgt af Prosper Maufoux. Horizon du Sud er Maufoux-familiens bud på en let og charmerende Chardonnay. Vinen udtrykker den elegance, som Chardonnay udviser, når den kommer fra Sydfrankrig. Den indeholder 13% alkohol. Farven er klar og lys gul med guld reflekser. Den er,4,70,Gul,L,T-shirts,Mand,MS17,,,,,,,,,
241,Vito Chardonnay,Her får du en blød og velsmagende hvidvin der er fremstillet af Chardonnay-druen, som indførtes i den sydlige del af Puglia for en snes år siden. Her kvitterer den for den meget sol med frodighed snarere end elegance. Det er en særdeles effektiv hvidvin med oversøisk inspiration. Den er gylden i farven og med en masse citrus frugter, ananas og,3,70,Grøn,M,Badetøj,Dame,MS17,,,,,,,,,,
242,Vito Negroamaro Zinfandel,Her får du en rødvin fra det det sydlige Italien. Puglia-regionen udgør hælen på støvlen af Italien.Denne syditalienske rødvin har en dejlig blødhed og sødme, der gør, at vinen vil være et hit hos mange. Puglia-regionens vine har i det hele taget igennem de sidste år flyttede sig højere op på den internationale rangstige.Druerne bliver dyrket i den sandede jord, so,2,69,Grøn,S,Jakker,Dame,MS17,,,,,,,,,
243,P.Maufoux Pinot Noir Horizon,Vinen har en klar og lys farve, med røde reflekser. Duften har noter af små røde bær. Smagen er mellemkraftig og afbalanceret, med nuancer af røde og sorte bær. Garvesyren gør at den er subti,56,30,Grøn,M,Jakker,Mand,MS17,,,,,,,,,,
244,Realzin Zinfandel Salento,Denne vin kommer fra vinfirmaet Rocca, der lige siden Francesco Rocca grundlagde firmaet i 1880 har været en del af vinindustrien i Italien. Firmaet hedder nu Angelo Rocca & Figli, og det ejes stadig af familien Rocca. I begyndelsen handlede firmaet kun med partivarer, men senere udvidede man med to vinerier med tilhørende,4,30,Gul,XL,Bukser,Dame,MS17,,,,,,,,,
245,Tabiso Shiraz,Vinen har en flot dybrød farve. Den har en let krydret og frugtig bouquet, med et strejf af egetræ. Smagen er utrolig delikat, fyldig og frugtrig med en blød og behagelig eftersmag. Den er lavet på 90% Shiraz og 10% Merlot og har en alkoholprocent p,8,130,Grøn,S,Bluser,Dame,MS17,,,,,,,,,,
246,Mango (formodnet),OBS: Da modningsprocessen er sat i gang i disse mangoer, vil de ved leveringen ikke være så hårde som de mangoer, man normalt finder i butikkerne. Det betyder ikke, at de er dårlige eller overmodne.. tværtimod er de lige klar til at spise og har en bedre smag end en hård mango.,4,15,Rød,S,Kjoler,Mand,MS17,,,,,,,,,
247,Lakridsrod,Lakridsrod er den tørrede rod af planten Glat Lakrids, der gros vildt og dyrkes i middelhavsområdet, Iran, Rusland, Kina og Tyrkiet. Roden gror ned til ca. 1 meter dybde, og dan skal være mindst 3 år gammel før høst.,11,58,Sort,L,Shorts,Dame,MS17,,,,,,,
248,Kvæde,Kvæde kommer fra et lille, løvfældende træ med en kort stamme og en tætgrenet, bred krone. Frugterne dufter ,8,60,Gul,XS,Shorts,Mand,MS17,,,,,,,,,,
249,Kokosnød øko.,Kokosnødder menes at stamme fra området omkring Polynesien og har været en uhyggeligt vigtig vare for de områder,,2,95,Gul,XS,Kjoler,Dame,MS17,,,,,,,,,,,
250,Kokosnød i tern,riskhedsgaranti: minimum 2 dages holdbarhed inkl. leveringsdagen.,7,100,Sort,L,Jakker,Dame,HS17,,,,,,,,,,,,
251,Drikke kokosnød,Inden frugtkødet dannes i en kokosnød, er unge kokosnødder fyldt med en klar væske (kokosvand). E,11,50,Sort,S,Jakker,Mand,HS17,,,,,,,,,,,
252,Figner (friske),Figner menes at stamme fra Vestasien og har været en meget værdsat frugt helt tilbage hos de gamle egyptere og,15,75,Sort,S,Jakker,Dame,MS17,,,,,,,,,,,,
253,Granatæble,Granatæblet menes at stamme fra Persien (omkring det nuværende Iran) og har været dyrket lige siden oldtiden. Senere har det bredt sig til store dele af verden, og nu dyrkes det i de fleste områder, hvor klimaet tillader det.,1,75,Sort,L,Bukser,Mand,MS17,,,,,,,,,,
254,Granatæble kerner,Granatæblet menes at stamme fra Persien (omkring det nuværende Iran) og har været dyrket lige siden oldtiden. Senere har det bredt sig til store dele af verden, og nu dyrkes det i de fleste områder, hvor klimaet tillader det.,3,75,Sort,S,Bluser,Mand,MS17,,,,,,,,,,
255,Granatæble øko.,Vask den og skær den i skiver, så den flotte stjerneform fremkommer. Den øverste del af ribben er ofte brun, og skæres derfor væk. I mi,7,100,Blå,M,Kjoler,Dame,MS17,,,,,,,,,,
256,Carambole,arambole menes at stamme fra det tropiske Asien, og den findes stadig vildt i Indonesien,9,50,Blå,M,Shorts,Dame,MS17,,,,,,,,,,,
257,Ananaskirsebær,nanaskirsebær (Physalis) stammer fra området omkring Peru og Chile og har været dyrket lige siden inkaernes tid.,4,150,Rød,M,Shorts,Mand,MS17,,,,,,,,,,,,
258,Ananas,Ananas stammer fra Sydamerika, hvor den har været dyrket af inkaerne, længe før Europæerne kom der til. Her fra blev den udbredt til Nordamerika og omkringligge,3,200,Gul,M,Kjoler,Dame,MS17,,,,,,,,,,
259,Ananas (lille),En umoden ananas er mørkegrøn, og efterhånden som den modnes, får den en mere gul-brunlig farve. En måde at tjekke modenheden på er ved at tage fat i et af,2,70,Grøn,XL,Jakker,Mand,MS17,,,,,,,,,,
260,Ananas (stor),En umoden ananas er mørkegrøn, og efterhånden som den modnes, får den en mere gul-brunlig farve. En måde at tjekke modenheden på er ved at tage fat i et af de,56,70,Grøn,S,Bluser,Mand,MS17,,,,,,,,,,
261,Æble i både,Æbler i både - klar til at spise.,4,70,Grøn,L,T-shirts,Mand,HS17,,,,,,,,,,,,
262,Frugtmix i tern,Æbler, cantaloupemelon og ananas og blåbær,8,69,Gul,L,T-shirts,Mand,HS17,,,,,,,,,,,
263,Melonmix i tern,Friskhedsgaranti: minimum 2 dages holdbarhed inkl. leveringsdagen.,9,30,Grøn,L,Badetøj,Dame,MS17,,,,,,,,,,,,
264,Hindbær,inger i forbindelse med plukning af bærene. Heldigvis er der meget stor produktion rundt omkring i verden, og efterhånden kan det lade sig gøre at have friske,7,30,Rød,S,Bluser,Dame,MS17,,,,,,,,,,,
265,Jordbær,en i starten af juni, med mindre der har været for meget nattefrost i maj. Sæsonen topper i slutningen af juni og starten af juli, men ved hjælp af nye dyrkningsmetoder kan der være danske jordbær indtil oktober måned. Op til den danske sæson er der masser af tyske og spanske bær, og resten af året importeres de fra,8,100,Sort,M,Bukser,Mand,MS17,,,,,,,,,
266,Blåbær,Blåbær dækker over en ret bred vifte af bær. De fleste danskere forbinder blåbær med de,2,50,Gul,M,Bukser,Dame,MS17,,,,,,,,,,,,
267,Jordbær,Den danske sæson er ikke specielt lang. De første bær plejer at være i handlen i starten af juni, med mindre der har været for meget nattefrost i maj. Sæsonen topper i slutningen af juni og starten af juli, men ved hjælp af nye dyrkningsmetoder kan der være danske jordbær indtil oktober måned. Op til den danske sæson,1,75,Gul,L,Jakker,Dame,MS17,,,,,,,,,,
268,Blåbær,Blåbær er indenfor de sidste 5 år blevet et af de helt store hits inden for frugtverdenen på grund af deres store indhold af gavnlige stoffer. De har blandt andet et stort indhold af antioxidanter, hvilket er en af grundene til," at sundheds-coachen Chris Macdonald betegner dem som en ""superfood"". Derudover smager de skønt og kan bruges i et hav af desserter", smoothies og bagværk.. eller nydes friske. ,11,75,Gul,S,Kjoler,Mand,MS17,,,,,,,,,
269,Hindbærjordbær,"På tysk hedder sorten ""Mieze Schindler""", og i DDR var det faktisk den mest udbredte af alle jordbærsorter. Det kan dog nok til dels tilskrives deres lidt anstrengte forh,1,75,Gul,M,Jakker,Dame,MS17,,,,,,,,,,,
270,Jordbær vilde,,3,100,Sort,L,Bluser,Dame,MS17,,,,,,,,,,,,
271,Bananjordbær,,6,50,Blå,S,T-shirts,Mand,MS17,,,,,,,,,,,,
272,Ferskenjordbær,Ferskenjordbær 100 g Ferskenjordbær bør opbevares på køl og har en forventet holdbarhed på et par dage.,9,150,Gul,L,T-shirts,Dame,HS17,,,,,,,,,,,,
273,Minicookies m. chokolade,28 g hvedemel, 21 g sukker, 20 g mørk chokolade (sukker, kakaomasse, kakaosmør, glukosesirup, emulgator (E 322 af soja), vaniljearoma), 12 g vegetabilsk olie, 10 g mælkechokolade,4,200,Gul,M,Badetøj,Dame,HS17,,,
274,Kammerjunkere,HVEDEMEL*, vegetabilsk olie* (palme), sukker*, naturlig vanilje ekstrakt, hævemidler (E,5,70,Sort,S,Bluser,Mand,PS17,,,,,,,,
275,Kammerjunkere,Hvedemel, grahamsmel (26%), sukker, vegetabilsk olie (raps), vegetabilsk fedtstof (raps og palme), rugsigtemel, hævemiddel (e500), invertsukker, mælkesukker, salt, aroma(vanilje), emulgator (raps lecithin).,5,70,Blå,XL,Bukser,Dame,PS17,
276,Kammerjunkere,,8,70,Blå,S,Bukser,Mand,PS17,,,,,,,,,,,,
277,Rugsprød knækbrød,Rugsprø er et tyndt og sprødt surdejbrød, bagt på 100% fuldkorn.,2,69,Rød,L,Bluser,Mand,PS17,,,,,,,,,,,
278,Knækbrød,Wasa Sesam & Havsalt er et lille rundt knækbrød bagt på hvede og toppet med gyldne sesamfrø og havsalt. En perfekt snack til at nyde med eller uden dit favorit pålæg!,7,30,Sort,XL,T-shirts,Dame,PS17,,,,,,,,,,,,
279,Sport knækbrød,Wasa Fuldkornsknækbrød med Rugklid Groft knækbrød som bages på fuldkorn og strøs med rugklid. Kostfibre er en del af kornet hvoraf størstedelen findes i kli,11,150,Gul,M,Jakker,Dame,PS17,,,,,,,,,,,,
280,Rågi knækbrød,Wasa Fuldkornsknækbrød m. Kostfibre Rågi Det fine og sprøde fuldkornsknækbrød, bagt på rug for den gode smags skyld. Med 73% fuldkorn og 14% kostfib,15,200,Gul,L,Jakker,Mand,PS17,,,,,,,,,,,
281,Knækbrød m. kanel,HVEDEMEL (80%), sukker, vegetabilsk fedtstof (palme, raps), gær, kanel, emulgator (mono- og diglycerider af fedtsyrer), salt.,1,70,Gul,M,Jakker,Dame,PS17,,,,,
282,Sandwichkiks,Kategoritilbud,3,70,Gul,S,Bukser,Mand,PS17,,,,,,,,,,,,
283,Havrekiks øko,ørt og ikke for varmt. Bedst før: Se dato på siden. Nettovægt,7,70,Gul,M,Bluser,Mand,PS17,,,,,,,,,,,,
284,Sprød kiks m,Hvedemel, frugtfyld (36%) [sultana rosiner, sukker, dextrose monohydrat, fugtighedsbevarende middel (glycerol), hvedeklid, æblekoncentrat, glucose fructosesirup, rismel, geleringsmiddel (pektin), kanel, citronsyre,,9,69,Rød,M,Kjoler,Mand,PS17
285,Fuldkornskiks øko,Kiksene indeholder ikke mælk og æg, og alt det udskældte hærdede fedt finder du heller ikke i kiksene, da det ikke må anvendes i økologiske produkter.,4,30,Rød,L,Shorts,Mand,PS17,,,,,,,,,,
286,Digestive (original),eret sukkersirup, hævemidler (natriumhydrogencarbonat, vinsyre, æblesyre), salt, skummetmælkspulver,3,150,Rød,M,Shorts,Dame,PS17,,,,,,,
287,Bondebrød,Klassisk Bondebrød er bagt på basis af rugsigtemel og er et helt lyst og mildt brød, bagt uden kerner.,2,200,Blå,S,Kjoler,Dame,PS17,,,,,,,,,,,
288,Rugbrød,Vores Nyt Nordisk Rugbrød med Solsikke og Hørfrø er en rugbrødsklassiker, men med et nyt twist der gør de,56,70,Gul,M,Jakker,Mand,PS17,,,,,,,,,,,
289,Rustikt fuldkorn øko,Rustikt brød fra Nyt Nordisk, bagt med rug fra Himmerland. Blødt og saftigt rugbrød med rugkerner, masser af hørfrø og en dejlig mild smag.,4,70,Sort,XL,Bluser,Dame,PS17,,,,,,,,,,
290,6-kerne rugbrød,Kernegodt 6-Kerne,8,70,Sort,S,T-shirts,Dame,PS17,,,,,,,,,,,,
291,Rugbrød m. solsikke,Surdej (vand, RUGMEL*(EU), surdejskultur), vand, halvsigtet RUGMEL, HVEDEMEL, 7 % RUGKERNER*, RUGMEL*,6,4,69,Sort,S,T-shirts,Mand,PS17,,,,
292,Familie quiz kryds og tværs,,11,30,Blå,L,Badetøj,Dame,PS17,,,,,,,,,,,,
293,Den fantastiske malebog,Malebog til børn og voksne - virker beroligende og styrker koncentrationsevnen,8,69,Gul,XS,Bluser,Dame,PS17,,,,,,,,,,,,
294,Malebog m. vilde dyr,Malebog til børn og voksne - virker beroligende og styrker koncentrationsevnen.,9,30,Grøn,XS,Bukser,Dame,PS17,,,,,,,,,,,,
295,Malebog m. havfruer,Malebog til børn og voksne - virker beroligende og styrker koncentrationsevnen.,7,30,Rød,L,Bukser,Mand,PS17,,,,,,,,,,,,
296,Aktivitetsbog med minifigur,Velkommen til LEGO® NEXO KNIGHTS™ heltenes fantastiske verden! Endnu engang befinder ridderne sig i begivenhedernes centrum. Hjælp de tapre riddere med at bekæmpe Jestro og Monsterbogen ved at løse mysterier og opgaver, og tag med d,8,100,Sort,S,Bluser,Dame,PS17,,,,,,,,,,,
297,Kryds og tværs,,2,50,Gul,S,T-shirts,Mand,PS17,,,,,,,,,,,,
298,Søndags kryds og tværs,,1,75,Gul,L,Jakker,Mand,MS17,,,,,,,,,,,,
299,Hjemmets quiz og tværs,Hæftet er fyldt med hyggelige, udfordrende, sjove og varierede opgaver og du er sikret mange timers dejlig underholdning. Men pas på! Hvis du køber et nummer af Hjemmets Quiz og,8,69,Gul,S,Jakker,Dame,PS17,,,,,,,,,,
300,Se & hør,ler om vi er inviteret med hjem hos de kendte. Med bladet følger også det bedste overblik over ugens tv-programmer. SE og HØR er Danmarks største ugeblad og et stærkt un,9,30,Grøn,M,T-shirts,Mand,MS17,,,,,,,,,,,,
