SKU,NAME,DESCRIPTION,QTY,PRICE,COLOR,SIZE,CATEGORY,GENDER,SEASON,,,,,,,,,,,,
111,Tenson Lorence ,Clarins - BB Cream SPF25 er cremen, der giver en mere ensartet hud samtidig med at revitalisere og beskytter den, BB cremen giver glød til ansigtet, så den virker naturligt smukkere. Med ét får du en perfekt ansigtsfarve. Den rige BB,5,95,Rød,S,Jakker,Dame,PS17,,,,,,,,,
112,Nike Sportswear Varsity Jacket,L'Oréal - Glam Nude BB Cream Fugtgivende hudepleje som forvandler sig til en let naturlig foundation Til dig der ønsker at bruge makeup uden, at det kan ses Perfekt til daglig brug L'OréalL'Oréal blev grundl,8,125,Rød,L,Bukser,Mand,PS17,,,,,,,,,,,
113,Hummel Sylvester Softshell Jacket,,2,125,Rød,M,Bluser,Dame,PS17,,,,,,,,,,,,
114,Hummel Mina Softshell Jacket,Mangler du en smart og funktionel jakke, til en aktiv hverdag? Så,7,125,Blå,S,Kjoler,Dame,PS17,,,,,,,,,,,
115,Nike Sportswear Advance 15 Jacket,Er du klædt på til sommeren? bliv det med et par Tenson Cado,11,95,Gul,XL,Shorts,Mand,PS17,,,,,,,,,,,,
116,Tenson Northpole Jacket,Highland Park Highland Park Distillery blev grundlagt i 1798 af David Robertson, hvor det fik sin officiel licens i 1826. Destilleriet blev bygget, hvor Magnus Eunson sommerhus stod. Eunson,15,79,Sort,S,Shorts,Dame,PS17,,,,,,,,,,
117,Hummel Authentic Charge Poly Shorts,The Laphroaig Distillery blev grundlagt i 1815 af de to brødre Donald og Alexander ,og var familieejet frem til 1954 hvor det sidste familiemedlem af Johnston familien Ian Hunter som døde uden af få børn. Derfor blev distilleriet overdraget til en af ha,1,130,Sort,L,Kjoler,Mand,PS17,,,,,,,,,,,
118,Nike Pro Dry Shorts Squard Cool Wz,? Fordi, du bliver nødt til at smage de silkebløde og eksklusive dråber fra Mazovia-regionen i Polen. Det bliver ikke mere delikat end Belvedere. Belvedere Vodka er angiveligt verdens første luksusvodka og nedstammer fra den lille by Zyradów," der er placeret på sletterne i det centrale Polen - her bliver den udformet i et 100 år gammelt destilleri. I 1993 blev den første Belvedere Vodka lanceret - og skabte en ny standard for vodkaer verden over. Flasken modtog ros fra anmeldere og blev hurtigt en kommerciel succes. Navnet Belvedere betyder ""smukt at se"" og er opkaldt efter Belweder-slottet i Warszawa - Polens versio",3,15,Sort,XL,Jakker,Mand,PS17,,,,,,,,,,
119,Hummel New Nostalgia Training Short,eson grundlagde Dalmore Distillery i 1893, og ejes i dag af Whyte og Mackay. I dag er det selskabets største destilleri, og flagskibet Brand. Dalmore er en af de mest legendariske destillerier i verden, og kendt for at lave noget af det fineste whisky i verden.,7,58,Sort,M,Bluser,Dame,PS17,,,,,,,,,
120,Hummel New Nostalgia Training Shorts,r du et udvalg på over 170 forskelige gins. Udover rundvisninger tilbydes også forskellige master classes,smagninger og gin-relaterede events. Vi mener bestemt at C.O.L.D er et besøg værd, du finder distilleriet og baren tæt på St Paul's Cathedral ved Fleet Street.,9,60,Sort,L,T-shirts,Dame,PS17,,,,,,,,,,
121,Nike Academy Knit Shorts 2,He build the distillery on the site of St. Drostan's Well, thus securing the priceless source of fresh spring water. In 1898, a fire destroyed several of the building of the distillery, and most of the whisky stocks. Charl,4,95,5,Blå,M,T-shirts,Mand,PS17,,,,,,,,
122,Hummel DBU Målmand Shorts,is the most fierce and detailed The Shredder figure ever, with multiple points of articulation. It is a replica of The Shredder as featured in the movie Teenage Mutant Ninja Turtles 2 Out of the Shadows.,3,100,Blå,S,Badetøj,Dame,PS17,,,,,,,,,,,
123,Tenson Skagway Jacket,rce and detailed Michelangelo figure ever, with multiple points of articulation. It is a replica of Michelangelo as featured in the movie Teena,2,50,Rød,M,Bluser,Mand,PS17,,,,,,,,,,,
124,Tenson Beckett,his is the most fierce and detailed Bebob figure ever, with multiple points of articulation. It is a replica of Bebob as featured in the movie Teenage Mutant Ninja Turtles 2 Out of the Shadows.,56,75,Gul,M,Bukser,Mand,PS17,,,,,,,,,,,
125,Salomon Discovery FZ,s is the most fierce and detailed Splinter figure ever, with multiple points of articulation. It is a replica of a Splinter as featured in the movie Teenage,4,75,Grøn,L,Bukser,Mand,PS17,,,,,,,,,,,
126,Hummel Mina Softshell Jacket,With rib edge at neckline, Collar type: Round neck, Large print, Single jersey, Care instructions: washing machine 40Â°,8,75,Grøn,M,Bluser,Mand,PS17,,,,,,,,
127,Haglöfs Husk Pant,edge at neckline, Collar type: Round neck, Large print, Rubber print, Single jersey, Care instructions: washing machine 40Â°,9,100,Grøn,S,T-shirts,Dame,PS17,,,,,,,
128,Salomon Speedcross 4,Ninja Turtles Green Team kamp vogn er klar til kamp. Ingen ting kan stoppe den, som er bevæbnet med kastestjerne affyrer og en kæmpe nunchuk.,7,50,Gul,M,Jakker,Dame,PS17,,,,,,,,,,,
129,Hummel Sandal Trekking,Maske kan du forvandle dig til din yndlings Turtles.,8,150,Grøn,XL,Jakker,Mand,PS17,,,,,,,,,,,,
130,Haglöfs Husk Jacket,elt licens produkt med Teenage Mutant Ninja turtles håndklæde100% bomuld70 x 140cmMaskin,2,200,Rød,S,Jakker,Dame,PS17,,,,,,,,,,,,
131,CMP Fix Hood Hybrid Jacket,Med denne super seje Turtles Maske kan du forvandle dig til din yndlings Turtles.,1,70,Sort,S,Bukser,Dame,PS17,,,,,,,,,,,,
132,CMP Fix Hood Hybrid Jacket,kline, Collar type: Round neck, Pants with elasticized waistband for comfortable movement, Super soft and comforta,11,70,Gul,L,Bluser,Mand,PS17,,,,,,,,,
133,Royal Copenhagen Prinsesse flad tallerken,inja Turtles motive, With rib edge at neckline, Collar type: Round neck, Large print, Care instructions: washing machine 40Â°, Single jersey, Super,1,70,Gul,XS,Kjoler,Dame,PS17,,,,,,
134,Holmegaard Old English blomsterskål,Stort håndklæde med stort klub logo så ingen er i tvivl om hvem du supporter!,3,69,Gul,XS,Shorts,Dame,PS17,,,,,,,,,,,,
135,Holmegaard DWL lanterne,Stort håndklæde med stort klub logo så ingen er i tvivl om hvem du supporter!,6,30,Gul,L,Shorts,Mand,PS17,,,,,,,,,,,,
136,Holmegaard Old English vase,2-pak baby body med korte ærmer100% bomuldOfficielt licenseret produktStr. guide 0-3 mdr = 62 cm3-6 mdr = 68 cm6-9 mdr = 74cm9-1,9,30,Rød,S,Kjoler,Dame,PS17,,,,,,,,,,,,
137,oyal Copenhagen Hvid halvblonde flad,T-shirt & shorts sæt 100% bomuld, Rib: 96% bomuld 4% elastane Officielt licenseret produkt Str. Guide 0-3 mdr = 62 cm 3-6 mdr = 68 cm 6-9 mdr = 74cm,4,95,Rød,S,Jakker,Dame,PS17,,,,,,,,,,,
138,Tenson Maxine,sleepsuit to fit 9 / 12 months (80cm)main: 100% cotton trim: 96%,5,125,Rød,L,Bluser,Mand,PS17,,,,,,,,,,,,
139,Mercedes B,Her er et virkeligt lækkert håndklæde med hætte, Dette håndklæde er i en flot pastel farve med motiver af karakterne fra F,5,125,Blå,S,T-shirts,Dame,PS17,,,,,,,,,,,
140,Mercedes A,"Smart sengetøj med motiver fra ""Forest""-serien. Sættet består af dynebetræk",8,125,Gul,M,T-shirts,Mand,PS17,,,,,,,,,,,,
141,Mercedes C,Denne lækre puslepude er PVC fri med blødt skumgummi fyld. Denne puslepude er det ideelle valg til ny bagte foræl,2,95,Sort,M,Badetøj,Mand,PS17,,,,,,,,,,,,
142,Mercedes E,Leveringstid,7,79,Sort,M,Bluser,Dame,PS17,,,,,,,,,,,,
143,BMW 120,TESTVINDER hos Adac som gruppe 1,2 og 3 stol. Monza Nova er en fantastisk ergonomisk autostol, som absolut er blandt de bedste i sin klasse,11,130,Sort,M,Bukser,Dame,PS17,,,,,,,,,,
144,BMW 330,Baby Dan - Sikkerhedsgitter - DanGate har sikkerheden i top, når det er monteret. Sikkerhedsgitteret har nemlig en indbygget indikator,15,15,Sort,XL,Bukser,Mand,PS17,,,,,,,,,,,
145,Wahl - Hårklipper Lithium Premium,BabyDan - Alfred - Junior seng - Hvid er det velovervejet valg for en god seng, når dit barn er kommet i tumlinge alderen eller til de første skoleår. Sengen er fremstillet med en god slids,1,58,Sort,S,Bluser,Dame,PS17,,,,,,,,,,,
146,Wahl - Hårklipper Lithium Premium,Leveringstid,3,60,Blå,L,T-shirts,Mand,PS17,,,,,,,,,,,,
147,Wahl - Hårtrimmer Hybrid LCD,TESTVINDER hos Adac som gruppe 1,2 og 3 stol. Monza Nova er en fantastisk ergonomisk autostol, som absolut er blandt de bedste i sin klasse,7,95,5,Blå,L,Jakker,Mand,MS17,,,,,,,,,
148,Wahl - Hair Trimmer Lithium,Baby Dan - Sikkerhedsgitter - DanGate har sikkerheden i top, når det er monteret. Sikkerhedsgitteret har nemlig en indbygget indikator,9,100,Rød,L,Jakker,Mand,MS17,,,,,,,,,,,
149,Moser - Hårklipper Moser,Leveringstid,4,50,Gul,S,T-shirts,Mand,MS17,,,,,,,,,,,,
150,Ferm Living - Plante Stativ Lille,TESTVINDER hos Adac som gruppe 1,2 og 3 stol. Monza Nova er en fantastisk ergonomisk autostol, som absolut er blandt de bedste i sin klasse,3,75,Grøn,M,Badetøj,Dame,MS17,,,,,,,,,,
151,Ferm Living - Hyldeknægte sæt á,Baby Dan - Sikkerhedsgitter - DanGate har sikkerheden i top, når det er monteret. Sikkerhedsgitteret har nemlig en indbygget indikator,2,75,Grøn,M,Bluser,Dame,MS17,,,,,,,,,,,
152,Ferm Living - Hyldeknægte sæt á,T-shirt & shorts sæt 100% bomuld, Rib: 96% bomuld 4% elastane Officielt licenseret produkt Str. Guide 0-3 mdr = 62 cm 3-6 mdr = 68 cm 6-9 mdr = 74cm,56,75,Grøn,L,Bukser,Mand,MS17,,,,,,,,,,,
153,Ferm Living - Brass Toiletpapirholder,sleepsuit to fit 9 / 12 months (80cm)main: 100% cotton trim: 96%,4,100,Gul,S,Bukser,Dame,MS17,,,,,,,,,,,,
154,Ferm Living - Hylde ,Her er et virkeligt lækkert håndklæde med hætte, Dette håndklæde er i en flot pastel farve med motiver af karakterne fra F,8,50,Grøn,M,Bluser,Dame,MS17,,,,,,,,,,,
155,Clarins - Fix MakeUp Refreshing,Her er et virkeligt lækkert håndklæde med hætte, Dette håndklæde er i en flot pastel farve med motiver af karakterne fra F,4,150,Rød,L,T-shirts,Mand,MS17,,,,,,,,,,,
156,Clarins - BB Cream SPF25,Clarins - BB Cream SPF25 er cremen, der giver en mere ensartet hud samtidig med at revitalisere og beskytter den, BB cremen giver glød til ansigtet, så den virker naturligt smukkere. Med ét får du en perfekt ansigtsfarve. Den rige BB,11,200,Sort,S,Jakker,Dame,MS17,,,,,,,,,
157,L'Oréal - Glam Nude BB Cream SPF20,L'Oréal - Glam Nude BB Cream Fugtgivende hudepleje som forvandler sig til en let naturlig foundation Til dig der ønsker at bruge makeup uden, at det kan ses Perfekt til daglig brug L'OréalL'Oréal blev grundl,8,70,Gul,L,Jakker,Mand,MS17,,,,,,,,,,,
158,L'Oréal - Glam Nude BB Cream SPF20,Clarins - BB Cream SPF25 er cremen, der giver en mere ensartet hud samtidig med at revitalisere og beskytter den, BB cremen giver glød til ansigtet, så den virker naturligt smukkere. Med ét får du en perfekt ansigtsfarve. Den rige BB,2,70,Gul,M,Jakker,Dame,MS17,,,,,,,,,
159,CMP Fix Hood Jacket,Mangler du en smart og funktionel jakke, til en aktiv hverdag? Så,7,70,Gul,S,Bukser,Dame,HS17,,,,,,,,,,,
160,Tenson Cado,Er du klædt på til sommeren? bliv det med et par Tenson Cado,11,69,Gul,XL,Bluser,Mand,HS17,,,,,,,,,,,,
161,Highland Par,Highland Park Highland Park Distillery blev grundlagt i 1798 af David Robertson, hvor det fik sin officiel licens i 1826. Destilleriet blev bygget, hvor Magnus Eunson sommerhus stod. Eunson,15,30,Sort,S,Kjoler,Dame,HS17,,,,,,,,,,
162,Laphroaig - 10 Års Islay Single Malt,The Laphroaig Distillery blev grundlagt i 1815 af de to brødre Donald og Alexander ,og var familieejet frem til 1954 hvor det sidste familiemedlem af Johnston familien Ian Hunter som døde uden af få børn. Derfor blev distilleriet overdraget til en af ha,1,30,Blå,L,Shorts,Mand,HS17,,,,,,,,,,,
163,Belvedere Vodka Pure,? Fordi, du bliver nødt til at smage de silkebløde og eksklusive dråber fra Mazovia-regionen i Polen. Det bliver ikke mere delikat end Belvedere. Belvedere Vodka er angiveligt verdens første luksusvodka og nedstammer fra den lille by Zyradów," der er placeret på sletterne i det centrale Polen - her bliver den udformet i et 100 år gammelt destilleri. I 1993 blev den første Belvedere Vodka lanceret - og skabte en ny standard for vodkaer verden over. Flasken modtog ros fra anmeldere og blev hurtigt en kommerciel succes. Navnet Belvedere betyder ""smukt at se"" og er opkaldt efter Belweder-slottet i Warszawa - Polens versio",3,100,Blå,XL,Shorts,Mand,HS17,,,,,,,,,,
164,Dalmore - 12 Års Highland Single Malt,,eson grundlagde Dalmore Distillery i 1893, og ejes i dag af Whyte og Mackay. I dag er det selskabets største destilleri, og flagskibet Brand. Dalmore er en af de mest legendariske destillerier i verden, og kendt for at lave noget af det fineste whisky i verden.,7,50,Rød,M,Kjoler,Dame,HS17,,,,,,,,
165,City of London - Sloe Gin,r du et udvalg på over 170 forskelige gins. Udover rundvisninger tilbydes også forskellige master classes,smagninger og gin-relaterede events. Vi mener bestemt at C.O.L.D er et besøg værd, du finder distilleriet og baren tæt på St Paul's Cathedral ved Fleet Street.,9,75,Sort,L,Jakker,Dame,HS17,,,,,,,,,,
166,Aberlour 12 YO,He build the distillery on the site of St. Drostan's Well, thus securing the priceless source of fresh spring water. In 1898, a fire destroyed several of the building of the distillery, and most of the whisky stocks. Charl,4,75,Gul,M,Jakker,Mand,HS17,,,,,,,,,
167,Turtles – Movie Basic Figure,is the most fierce and detailed The Shredder figure ever, with multiple points of articulation. It is a replica of The Shredder as featured in the movie Teenage Mutant Ninja Turtles 2 Out of the Shadows.,3,75,Rød,S,Bukser,Dame,HS17,,,,,,,,,,,
168,Turtles – Movie Basic Figure - Michelangelo (88003),rce and detailed Michelangelo figure ever, with multiple points of articulation. It is a replica of Michelangelo as featured in the movie Teena,2,100,Rød,M,Bluser,Mand,HS17,,,,,,,,,,,
169,Turtles – Movie Basic Figure - Bebob (88014),his is the most fierce and detailed Bebob figure ever, with multiple points of articulation. It is a replica of Bebob as featured in the movie Teenage Mutant Ninja Turtles 2 Out of the Shadows.,56,50,Rød,M,Kjoler,Mand,HS17,,,,,,,,,,,
170,Turtles – Movie Basic Figure - Splinter (88009),s is the most fierce and detailed Splinter figure ever, with multiple points of articulation. It is a replica of a Splinter as featured in the movie Teenage,4,150,Blå,L,Shorts,Mand,HS17,,,,,,,,,,,
171,Ninja Turtles Long Sleeve T-Shirt navy blue,With rib edge at neckline, Collar type: Round neck, Large print, Single jersey, Care instructions: washing machine 40Â°,8,200,Gul,M,Shorts,Mand,HS17,,,,,,,,
172,Ninja Turtles Long Sleeve T-Shirt grey,edge at neckline, Collar type: Round neck, Large print, Rubber print, Single jersey, Care instructions: washing machine 40Â°,9,70,Sort,S,Kjoler,Dame,HS17,,,,,,,
173,Turtles - Skraldebil,Ninja Turtles Green Team kamp vogn er klar til kamp. Ingen ting kan stoppe den, som er bevæbnet med kastestjerne affyrer og en kæmpe nunchuk.,7,70,Sort,M,Jakker,Dame,MF17,,,,,,,,,,,
174,Teenage Mutant Ninja Turtles - Maske - Leonardo,Maske kan du forvandle dig til din yndlings Turtles.,8,70,Sort,XL,Bluser,Mand,MF17,,,,,,,,,,,,
175,Teenage Mutant Ninja Turtles - Towel - Dimension,elt licens produkt med Teenage Mutant Ninja turtles håndklæde100% bomuld70 x 140cmMaskin,2,69,Sort,S,T-shirts,Dame,MF17,,,,,,,,,,,,
176,Teenage Mutant Ninja Turtles - Maske - Raphael,Med denne super seje Turtles Maske kan du forvandle dig til din yndlings Turtles.,1,30,Sort,S,T-shirts,Dame,MF17,,,,,,,,,,,,
177,Ninja Turtles Pyjama grey,kline, Collar type: Round neck, Pants with elasticized waistband for comfortable movement, Super soft and comforta,11,30,Blå,L,Badetøj,Mand,MF17,,,,,,,,,
178,Ninja Turtles Short Sleeve T-Shirt blue,inja Turtles motive, With rib edge at neckline, Collar type: Round neck, Large print, Care instructions: washing machine 40Â°, Single jersey, Super,1,95,Blå,XS,Bluser,Dame,MF17,,,,,,
179,FC Barcelona - Håndklæde,Stort håndklæde med stort klub logo så ingen er i tvivl om hvem du supporter!,3,125,Rød,XS,Bukser,Dame,MF17,,,,,,,,,,,,
180,Manchester City - Håndklæde,Stort håndklæde med stort klub logo så ingen er i tvivl om hvem du supporter!,6,125,Gul,L,Bukser,Mand,MF17,,,,,,,,,,,,
181,Chelsea - 2-Pak Baby Body - 6-9 mth,2-pak baby body med korte ærmer100% bomuldOfficielt licenseret produktStr. guide 0-3 mdr = 62 cm3-6 mdr = 68 cm6-9 mdr = 74cm9-1,9,125,Grøn,S,Bluser,Dame,MF17,,,,,,,,,,,,
182,Liverpool - T-shirt og Shorts Sæt - 18-23 mdr,T-shirt & shorts sæt 100% bomuld, Rib: 96% bomuld 4% elastane Officielt licenseret produkt Str. Guide 0-3 mdr = 62 cm 3-6 mdr = 68 cm 6-9 mdr = 74cm,4,95,Grøn,S,T-shirts,Dame,MF17,,,,,,,,,,,
183,Chelsea - Natdragt - 9-12 mth,sleepsuit to fit 9 / 12 months (80cm)main: 100% cotton trim: 96%,5,79,Grøn,L,Jakker,Mand,MF17,,,,,,,,,,,,
184,Sebra - Håndklæde med hætte,Her er et virkeligt lækkert håndklæde med hætte, Dette håndklæde er i en flot pastel farve med motiver af karakterne fra F,5,130,Gul,S,Jakker,Dam,MF17,,,,,,,,,,,
185,Sebra - Sengetøj, Junior - Blå - Forest,"Smart sengetøj med motiver fra ""Forest""-serien. Sættet består af dynebetræk",8,15,Grøn,M,Jakker,Mand,MF17,,,,,,,,,,,
186,Baby Dan - Puslepude - Beige,Denne lækre puslepude er PVC fri med blødt skumgummi fyld. Denne puslepude er det ideelle valg til ny bagte foræl,2,58,Rød,M,Bukser,Mand,MF17,,,,,,,,,,,,
187,Pokemon - Towel - Catch Towel,Leveringstid,7,60,Sort,M,Bluser,Dame,MF17,,,,,,,,,,,,
188,Recaro - Autostol - Monza Nova IS (61482153466) - Sort - TESTVINDER,TESTVINDER hos Adac som gruppe 1,2 og 3 stol. Monza Nova er en fantastisk ergonomisk autostol, som absolut er blandt de bedste i sin klasse,11,95,5,Gul,M,Kjoler,Dame,MF17,,,,,,,,,
189,Baby Dan - Sikkerhedsgitter - DanGate (50394-2400-01),Baby Dan - Sikkerhedsgitter - DanGate har sikkerheden i top, når det er monteret. Sikkerhedsgitteret har nemlig en indbygget indikator,15,100,Gul,XL,Shorts,Mand,MF17,,,,,,,,,,,
190,Baby Dan - Alfred - Junior seng - 70x160 cm - White (1163-01),BabyDan - Alfred - Junior seng - Hvid er det velovervejet valg for en god seng, når dit barn er kommet i tumlinge alderen eller til de første skoleår. Sengen er fremstillet med en god slids,1,50,Gul,S,Shorts,Dame,MF17,,,,,,,,,,,
191,NIKE AIR MAX 90 ULTRA 2.0 FLYKNIT,erdens mest populære Air Max genopfindes i Nike Air Max 90 Ultra 2.0 Flyknit-skoen til mænd med en lettere og blødere fornemmelse end nogensinde før takket være fleksibelt Flyknit og Ultra 2.0-stødabsorbering.,3,75,Gul,L,Kjoler,Mand,MF17,,,,,,,,,,,,
192,NIKE AIR MAX 90 ESSENTIAL,Nike Air Max 90 Essential-skoen til mænd har den fantastiske affjedring, der gjorde skoen berømt, og er tidløs og behagelig med et flot udtryk og en god pasform.,7,75,Rød,L,Jakker,Mand,MF17,,,,,,,,,,
193,NIKE AIR MAX PLUS TN ULTRA,ike Air Max Plus Tn Ultra-skoen til mænd har indersokskonstruktion med TPU-belægning, som giver en støttende, strømpelignende pasform, mens en blød mellemsål med hæl samt Air-Sole-enheder i forfoden giver responsiv stødabsorbering.,9,75,Rød,L,Bluser,Mand,MF17,,,,,,,,,
194,NIKE FREE RN 2017,Da de fandt ud af, at Stanford-atleter trænede barfodet, fik tre af Nikes mest innovative og kreative medarbejdere idéen til at udvikle en sko, d,4,100,Rød,S,T-shirts,Mand,MF17,,,,,,,,,
195,NIKE AIR MAX LD-ZERO,Nikes revolutionerende Air-Sole-enhed blev en del af Nike-fodtøj sidst i 70’erne. I 1987 så Nike Air Max 1 første gang dagens lys med synlig luft i hælen, hvilket gav fans mulighed for ikke bare at mærke Air-Sole-kom,3,50,Blå,M,T-shirts,Dame,MF17,,,,,,,,,,,
196,NIKE PRESTO FLY,t on un donne un coté habillé et décontracté à la fois, de plus elle sont très agréable du faite qu'elles soient très légère.,2,150,Gul,M,Badetøj,Dame,MF17,,,,,,,,,,,
197,NIKE PRESTO FLY,Nike Presto Fly-skoen til mænd, som er en opdatering af originalen fra 2000, giver en T-shirt-lignende fornemmelse om din fod med en åndbar, fleksibel overdel.,56,200,Sort,L,Bluser,Mand,MF17,,,,,,,,,
198,NIKE FREE RN FLYKNIT 2017,Nike Free RN Flyknit 2017-løbeskoen til mænd giver kilometervis af komfort med en enestående fleksibel ydersål for det ultimative naturlige lø,4,70,Sort,S,Bukser,Dame,MF17,,,,,,,,,,,,
199,NIKE AIR MAX 90 ESSENTIAL,Nike Air Max 90 Essential-skoen til mænd har den fantastiske affjedring, der gjorde skoen berømt, og er tidløs og behagelig med et flot udtryk og en god pasform.,8,70,Sort,M,Bukser,Dame,MF17,,,,,,,,,,
200,NIKE CORTEZ ULTRA MOIRE,Nike Cortez Ultra Moire-skoen til mænd frisker Nikes første løbesko op med et moderne touch.,4,70,Sort,L,Bluser,Mand,MF17,,,,,,,,,,,,
201,NIKE AIR MAX 2017,Nike Air Max 2017-løbeskoen til mænd har et sømløst design med støtte og åndbarhed, hvor du har brug for det, samt en ,11,69,Sort,S,T-shirts,Dame,MF17,,,,,,,,,,
202,NIKE SB STEFAN JANOSKI MAX,Nike SB Stefan Janoski Max-skaterskoen til mænd, der er designet med inspiration fra en skaterlegende, har fantastisk stødabsorbering og får enhver tur til at føles naturlig takket være Max Air-enheden under hælen og de dybe, bøjelige riller,5,30,Blå,S,Jakker,Dame,MF17,,,,,,,,,
203,AIR JORDAN 4 RETRO,En af de mest eftertragtede skomodeller får et vintage-løft i Air Jordan 4 Retro-skoen til mænd. Skoen har sidestøtte ved anklerne og innovative materialer i overdelen, som g,8,30,Blå,L,Jakker,Mand,MF17,,,,,,,,,,,
204,NIKELAB AIR MAX 1 PINNACLE,NikeLab Air Max 1 Pinnacle-skoen til mænd opgraderer den originale profil med en minimalistisk overdel med farveblokering for et moderne look, der passer t,2,95,Rød,XS,T-shirts,Dame,MF17,,,,,,,,,,,
205,NIKE FLYKNIT RACER,stort set ubemærkede) pasform som en strømpe. Nike tog sammen med hold af programmører, ingeniører og designere hul på en fireårig mission om at skabe den nødvendige teknologi til at lave denne stri,7,125,Gul,XS,Badetøj,Dame,PS17,,,,,,,,,,,
206,NIKE AIR VAPORMAX FLYKNIT,"Air VaporMax repræsenterer en ny æra inden for Nike-innovation. ""Den har ændret hele vores filosofi omkring", hvordan vi designer for Air," siger Zachary Elder, Cushioning Innovation Designer. Med VaporMax ønskede designerne virkelig at indfange følelsen af at løbe på luft"". De startede med at omstrukturere Air-enhed",11,125,Grøn,L,Bluser,Mand,PS17,,,,,,,,,,
207,Ralph Lauren Polo Herre Solid Stretch Mesh,Hos Pro Golf forhandler vi Ralph Lauren Golf. Mærket er kendt for tidløst design og høj kvalitet. Hos Pro Golf finder du også tøj med mærket Ralph Lauren RLX,15,125,Grøn,S,Bukser,Dame,PS17,,,,,,,,,,,,
208,Cleveland Wedge RTX-3 Tour Satin,Cleveland har flyttet tyndepunktet (CG) fra hoselen og ind mod midten af slagfladen. Dette giver dig forbedret fornemmelse, øget stabilitet, større tilgivelse og sidste men ikke mindst bedre afstandskontrol.,1,95,Grøn,S,Bukser,Mand,PS17,,,,,,,,,,
209,Ecco Golfsko Dame Speed Hybrid,Speed Hybrid golfskoen er udført i læder og tekstil som blevet behandlet for høj åndbarhed og har desuden en enestående pasform. Skoen er utrolig let, tynd og fleksibel, mens den stadig er utrolig stærk. Golfskoen er udstyret med slidstærk sål som giver o,3,79,Gul,L,Bluser,Mand,PS17,,,,,,,,,,
210,G-Mac Polo Herre Malone,alone poloen er udført i super blødt polyester materiale, der sammen med spandex sørger for optimal bevægelsesfrihed. Poloen er desuden med UV filter, således solens stråler mindskes på kroppen.,7,130,Grøn,S,T-shirts,Dame,PS17,,,,,,,,,,
211,WIlson Feel Plus Dame Handske,bedre pasform. Golfhandsken er med læderforstærkede områder på håndfladen for ultimativ grip og komfort.,9,15,Rød,M,Jakker,Dame,PS17,,,,,,,,,,,,
212,iCart One Click Golfvogn,iCart One Click vognen er den ultimative golfvogn, som foldes sammen ved blot et enkelt tryk på en knap. Perfekt golfvogn til enhver type golfbag, og så er den en fornøjelse at køre med i alle terræner.,4,58,Sort,M,Jakker,Mand,PS17,,,,,,,,,,
213,Srixon Marathon Golfbolde,Kan anbefales til alle typer spillere, uanset handicap, der ønsker en langtflyvende og hårdfør golfbold, der samtidigt føles blødere at chippe og putte med.,3,60,Gul,M,Jakker,Dame,PS17,,,,,,,,,
214,Garmin Approach G6 Golf GPS,6 Golf GPS'en er pakket med nye software- og designtiltag, skabt til at løfte dit spil et niveau. Med mere end 25.000 forudlæste baner i hele verden præinstalleret og et internt genopladeligt batteri, er Approach G6 golf GPS'en den ultimative hjælp for den seriøse spiller.,2,95,Gul,M,Bukser,Mand,PS17,,,,,,,,,,
215,Wilson Staff Vognbag iLock '17,Ilock bag'en har en smart indrettet top hvor det er muligt," at ""låse"" jernene fast", så de ikke ramler sammen når du kører med bag'en på vogn.,56,100,Gul,XL,Bluser,Mand,PS17,,,,,,,,,,
216,TaylorMade Driver M2 '17,lorMade har bygget denne driver som hjælper golfspilleren med at modvirke den velkendte slice. D-Type driveren giver i gennemsnit 11 meter mere og op til 18 mere længde og hjælper med at modvirke den trælse slice.,4,50,Gul,S,Kjoler,Mand,PS17,,,,,,,,,,,,
217,TaylorMade Driver M2 D-type,lorMade har bygget denne driver som hjælper golfspilleren med at modvirke den velkendte slice. D-Type driveren giver i gennemsnit 11 meter mere og op til 18 mere længde og hjælper med at modvirke den trælse slice.,8,75,Sort,L,Shorts,Mand,PS17,,,,,,,,,,,,
218,TaylorMade Fairway M2 '17,TaylorMade har bygget fairwaykøllen med et nyt 6 lags carbon materiale, som har flyttet center of gravity helt tilbage i køllen for en mere effektiv kraftoverførelse, hvilket betyder at du som spiller for højere boldhastighed og længde.,9,75,Blå,L,Shorts,Dame,PS17,,,,,,,,,,
219,TaylorMade Fairway M2 Tour '17,TaylorMade har bygget fairwaykøllen med et nyt 6 lags carbon materiale, som har flyttet center of gravity helt tilbage i køllen for en mere effektiv kraftoverførelse, hvilket betyder at du som spiller for højere boldhastighed og længde.,7,75,Blå,S,Kjoler,Dame,PS17,,,,,,,,,,
220,TaylorMade Hybrid M2 '17,TaylorMade M2 hybridkøllen leveres som standard med et REAX skaft 85g (Stiff) 75g (Regular) 65g (Senior) 55 (Dame) og et lækkert Dual Feel Performance grip.,8,100,Rød,L,Jakker,Mand,PS17,,,,,,,,,,,,
